{"$schema":"https://json-schema.org/draft/2020-12/schema","additionalProperties":false,"properties":{"authorizationId":{"const":"phase-4/v1"},"baseCommit":{"const":"62f046adff7418d2e644365fc04bd5d6312dcca9"},"cleanExpectedPaths":{"maxItems":0,"type":"array"},"contexts":{"minItems":2,"type":"array"},"dirtyExpectedPaths":{"items":{"type":"string"},"minItems":22,"maxItems":22,"type":"array","uniqueItems":true},"evidence":{"type":"object"},"operationFamilies":{"type":"array"},"outputRoot":{"const":"output/spec-0001/phase-4"},"planVersion":{"const":4},"proofPurpose":{"const":"phase-4"},"registry":{"type":"object"},"specId":{"const":"SPEC-0001"},"steps":{"minItems":1,"type":"array"}},"required":["planVersion","specId","proofPurpose","authorizationId","baseCommit","dirtyExpectedPaths","cleanExpectedPaths","outputRoot","operationFamilies","registry","contexts","steps","evidence"],"type":"object"}
