{
  "planVersion": 4,
  "specId": "SPEC-0001",
  "proofPurpose": "phase-4",
  "authorizationId": "phase-4/v1",
  "baseCommit": "62f046adff7418d2e644365fc04bd5d6312dcca9",
  "dirtyExpectedPaths": [
    "scripts/finalizeSpec0001ProofBundle.ts",
    "scripts/fixtures/spec0001-browser/v1/phase-4-action-registry.json",
    "scripts/fixtures/spec0001-browser/v2/tester-extension-authorizations.json",
    "scripts/fixtures/spec0001-browser/v4/tester-extension-authorization.schema.json",
    "scripts/fixtures/spec0001-browser/v4/tester-extension-plan.schema.json",
    "scripts/fixtures/spec0001-browser/v4/tester-extension-registry.schema.json",
    "scripts/fixtures/spec0001-browser/v4/tester-extension-result.schema.json",
    "scripts/fixtures/stick-ai/v1/phase-4-browser-proof-plan.json",
    "scripts/fixtures/stick-ai/v1/phase-4-proof-commands.json",
    "scripts/fixtures/stick-ai/v1/stick-command-publication-race-cases.json",
    "scripts/fixtures/stick-ai/v1/stick-command-transaction-cases.json",
    "scripts/recordSpec0001ProofBundle.ts",
    "scripts/runSpec0001BrowserProof.ts",
    "scripts/spec0001-browser/actions/phase4.ts",
    "scripts/spec0001-browser/browserTesterExtensionContract.ts",
    "scripts/validateSpec0001ProofBundle.ts",
    "scripts/validateStickFigureCommandTransaction.ts",
    "src/components/workspace/stickfigure/StickFigureWorkspace.tsx",
    "src/lib/ai/stickFigureAiContract.ts",
    "src/lib/ai/stickFigureCommandExecutor.ts",
    "src/lib/stickfigure/stickProjectContract.ts",
    "src/lib/stickfigure/stickProjectHistory.ts"
  ],
  "cleanExpectedPaths": [],
  "outputRoot": "output/spec-0001/phase-4",
  "operationFamilies": ["checkpoint", "fixture", "pointer", "protected-regression", "runner-environment", "screenshot", "visible-role", "visible-testid", "workspace-driver"],
  "registry": {"path":"scripts/fixtures/spec0001-browser/v1/phase-4-action-registry.json","byteLength":31687,"sha256":"sha256:e7689fe36f5a1399e2fa12aea79ed7860f789edd5666e22f182917400f357166"},
  "contexts": [
    {"contextId":"abort-1440x900","viewport":{"width":1440,"height":900}},
    {"contextId":"cancel-1440x900","viewport":{"width":1440,"height":900}},
    {"contextId":"apply-1440x900","viewport":{"width":1440,"height":900}},
    {"contextId":"publication-1440x900","viewport":{"width":1440,"height":900}},
    {"contextId":"failure-envelope-1440x900","viewport":{"width":1440,"height":900}},
    {"contextId":"failure-action-1440x900","viewport":{"width":1440,"height":900}},
    {"contextId":"failure-candidate-1440x900","viewport":{"width":1440,"height":900}},
    {"contextId":"failure-hashing-1440x900","viewport":{"width":1440,"height":900}},
    {"contextId":"failure-history-1440x900","viewport":{"width":1440,"height":900}},
    {"contextId":"conflict-1440x900","viewport":{"width":1440,"height":900}},
    {"contextId":"authored-race-1440x900","viewport":{"width":1440,"height":900}},
    {"contextId":"project-race-1440x900","viewport":{"width":1440,"height":900}},
    {"contextId":"arm-1440x900","viewport":{"width":1440,"height":900}}
  ],
  "steps": [
    {"stepId":"001-abort-request","actionId":"abort-request-start","contextId":"abort-1440x900"},
    {"stepId":"002-abort-requesting","actionId":"abort-requesting-checkpoint","contextId":"abort-1440x900"},
    {"stepId":"003-abort","actionId":"abort-request","contextId":"abort-1440x900"},
    {"stepId":"004-abort-terminal","actionId":"abort-terminal-checkpoint","contextId":"abort-1440x900"},
    {"stepId":"005-cancel-request","actionId":"cancel-request-start","contextId":"cancel-1440x900"},
    {"stepId":"006-cancel-preview","actionId":"cancel-preview","contextId":"cancel-1440x900"},
    {"stepId":"007-cancel-redeliver-preview","actionId":"cancel-preview-redelivery","contextId":"cancel-1440x900"},
    {"stepId":"008-cancel","actionId":"cancel-preview-action","contextId":"cancel-1440x900"},
    {"stepId":"009-cancel-redeliver-terminal","actionId":"cancel-terminal-redelivery","contextId":"cancel-1440x900"},
    {"stepId":"010-cancel-terminal","actionId":"cancel-terminal-checkpoint","contextId":"cancel-1440x900"},
    {"stepId":"011-apply-request","actionId":"apply-request-start","contextId":"apply-1440x900"},
    {"stepId":"012-apply-preview","actionId":"apply-preview","contextId":"apply-1440x900"},
    {"stepId":"013-apply","actionId":"apply-command","contextId":"apply-1440x900"},
    {"stepId":"014-apply-duplicate","actionId":"apply-duplicate-redelivery","contextId":"apply-1440x900"},
    {"stepId":"015-apply-checkpoint","actionId":"apply-applied-checkpoint","contextId":"apply-1440x900"},
    {"stepId":"016-undo-enabled","actionId":"apply-undo-enabled","contextId":"apply-1440x900"},
    {"stepId":"017-undo","actionId":"apply-undo","contextId":"apply-1440x900"},
    {"stepId":"018-undone","actionId":"apply-undone-checkpoint","contextId":"apply-1440x900"},
    {"stepId":"019-redo-enabled","actionId":"apply-redo-enabled","contextId":"apply-1440x900"},
    {"stepId":"020-redo","actionId":"apply-redo","contextId":"apply-1440x900"},
    {"stepId":"021-redone","actionId":"apply-redone-checkpoint","contextId":"apply-1440x900"},
    {"stepId":"021-manual-down","actionId":"apply-manual-joint-down","contextId":"apply-1440x900"},
    {"stepId":"021-manual-move","actionId":"apply-manual-joint-move","contextId":"apply-1440x900"},
    {"stepId":"021-manual-up","actionId":"apply-manual-joint-up","contextId":"apply-1440x900"},
    {"stepId":"021-manual-checkpoint","actionId":"apply-manual-edit-checkpoint","contextId":"apply-1440x900"},
    {"stepId":"021-manual-undo","actionId":"apply-manual-undo","contextId":"apply-1440x900"},
    {"stepId":"021-manual-undone","actionId":"apply-manual-undone-checkpoint","contextId":"apply-1440x900"},
    {"stepId":"021-manual-redo","actionId":"apply-manual-redo","contextId":"apply-1440x900"},
    {"stepId":"021-manual-redone","actionId":"apply-manual-redone-checkpoint","contextId":"apply-1440x900"},
    {"stepId":"022-apply-screenshot","actionId":"apply-post-screenshot","contextId":"apply-1440x900"},
    {"stepId":"023-tools","actionId":"apply-tools","contextId":"apply-1440x900"},
    {"stepId":"024-creator","actionId":"apply-creator-enabled","contextId":"apply-1440x900"},
    {"stepId":"025-play","actionId":"apply-play","contextId":"apply-1440x900"},
    {"stepId":"026-playing","actionId":"apply-playing-checkpoint","contextId":"apply-1440x900"},
    {"stepId":"027-pause","actionId":"apply-pause","contextId":"apply-1440x900"},
    {"stepId":"028-paused","actionId":"apply-paused-checkpoint","contextId":"apply-1440x900"},
    {"stepId":"029-publication-request","actionId":"publication-request-start","contextId":"publication-1440x900"},
    {"stepId":"030-publication-preview","actionId":"publication-preview","contextId":"publication-1440x900"},
    {"stepId":"031-publication-begin","actionId":"publication-begin-action","contextId":"publication-1440x900"},
    {"stepId":"032-publication-redeliver","actionId":"publication-commit-redelivery","contextId":"publication-1440x900"},
    {"stepId":"033-publication-committing","actionId":"publication-committing-checkpoint","contextId":"publication-1440x900"},
    {"stepId":"034-publication-complete","actionId":"publication-complete-action","contextId":"publication-1440x900"},
    {"stepId":"035-publication-duplicate","actionId":"publication-duplicate-redelivery","contextId":"publication-1440x900"},
    {"stepId":"036-publication-applied","actionId":"publication-applied-checkpoint","contextId":"publication-1440x900"},
    {"stepId":"037-publication-screenshot","actionId":"publication-post-screenshot","contextId":"publication-1440x900"},
    {"stepId":"038-failure-envelope-request","actionId":"failure-envelope-request-start","contextId":"failure-envelope-1440x900"},
    {"stepId":"039-failure-envelope-baseline","actionId":"failure-envelope-baseline","contextId":"failure-envelope-1440x900"},
    {"stepId":"040-failure-envelope","actionId":"failure-envelope-execute","contextId":"failure-envelope-1440x900"},
    {"stepId":"040-failure-envelope-terminal","actionId":"failure-envelope-terminal","contextId":"failure-envelope-1440x900"},
    {"stepId":"040-failure-action-request","actionId":"failure-action-request-start","contextId":"failure-action-1440x900"},
    {"stepId":"040-failure-action-baseline","actionId":"failure-action-baseline","contextId":"failure-action-1440x900"},
    {"stepId":"040-failure-action","actionId":"failure-action-execute","contextId":"failure-action-1440x900"},
    {"stepId":"040-failure-action-terminal","actionId":"failure-action-terminal","contextId":"failure-action-1440x900"},
    {"stepId":"040-failure-candidate-request","actionId":"failure-candidate-request-start","contextId":"failure-candidate-1440x900"},
    {"stepId":"040-failure-candidate-baseline","actionId":"failure-candidate-baseline","contextId":"failure-candidate-1440x900"},
    {"stepId":"040-failure-candidate","actionId":"failure-candidate-execute","contextId":"failure-candidate-1440x900"},
    {"stepId":"040-failure-candidate-terminal","actionId":"failure-candidate-terminal","contextId":"failure-candidate-1440x900"},
    {"stepId":"040-failure-hashing-request","actionId":"failure-hashing-request-start","contextId":"failure-hashing-1440x900"},
    {"stepId":"040-failure-hashing-baseline","actionId":"failure-hashing-baseline","contextId":"failure-hashing-1440x900"},
    {"stepId":"040-failure-hashing","actionId":"failure-hashing-execute","contextId":"failure-hashing-1440x900"},
    {"stepId":"040-failure-hashing-terminal","actionId":"failure-hashing-terminal","contextId":"failure-hashing-1440x900"},
    {"stepId":"040-failure-history-request","actionId":"failure-history-request-start","contextId":"failure-history-1440x900"},
    {"stepId":"040-failure-history-baseline","actionId":"failure-history-baseline","contextId":"failure-history-1440x900"},